{
  "schemaVersion": 1,
  "generatedAt": "2026-07-28T00:52:46.790Z",
  "package": "openclaw",
  "decision": "hold",
  "baseline": {
    "channel": "stable",
    "version": "2026.7.1-2",
    "eligible": false,
    "reasons": [
      "status-not-supported",
      "runtime-evidence-missing",
      "checks-pending",
      "shrinkwrap-inconsistent"
    ],
    "observations": {
      "status": "probing",
      "runtimeEvidence": false,
      "checks": {
        "pass": 1,
        "warn": 3,
        "fail": 0,
        "pending": 15
      },
      "shrinkwrapConsistent": false,
      "gatewayClassification": "unchanged",
      "dependencyRiskCount": 0,
      "truncatedDependencyRiskCount": 0
    }
  },
  "candidate": {
    "channel": "preview",
    "version": "2026.7.2-beta.4",
    "eligible": false,
    "reasons": [
      "status-not-supported",
      "runtime-evidence-missing",
      "checks-pending",
      "shrinkwrap-inconsistent",
      "gateway-contract-breaking"
    ],
    "observations": {
      "status": "probing",
      "runtimeEvidence": false,
      "checks": {
        "pass": 1,
        "warn": 3,
        "fail": 0,
        "pending": 15
      },
      "shrinkwrapConsistent": false,
      "gatewayClassification": "breaking",
      "dependencyRiskCount": 29,
      "truncatedDependencyRiskCount": 0
    }
  },
  "rollback": {
    "channel": "previous",
    "version": "2026.6.33",
    "eligible": false,
    "reasons": [
      "status-not-supported",
      "runtime-evidence-missing",
      "checks-pending",
      "shrinkwrap-inconsistent",
      "gateway-contract-breaking"
    ],
    "observations": {
      "status": "probing",
      "runtimeEvidence": false,
      "checks": {
        "pass": 1,
        "warn": 3,
        "fail": 0,
        "pending": 15
      },
      "shrinkwrapConsistent": false,
      "gatewayClassification": "breaking",
      "dependencyRiskCount": 16,
      "truncatedDependencyRiskCount": 0
    }
  }
}
